{
  "$schema": "https://json-schema.org/draft/2020-12/schema",
  "$id": "https://raw.githubusercontent.com/vijay-inner-compass/pravetra-delivery-pack-spec/v1.1.0/schemas/v1/task-packet.schema.json",
  "title": "TaskPacket",
  "description": "Universal Delivery Pack Specification v1.0 atomic task packet contract consumed by autonomous coding agents and execution engines.",
  "type": "object",
  "required": [
    "taskId",
    "title",
    "outcome",
    "status",
    "sequence",
    "parallelSafe",
    "humanApprovalRequired",
    "dependsOn",
    "unlocks",
    "targetScope",
    "allowedChanges",
    "prohibitedChanges",
    "implementationSteps",
    "definitionOfDone"
  ],
  "properties": {
    "taskId": {
      "type": "string",
      "pattern": "^TASK-\\d{3,}(\\.\\d+)?$",
      "description": "Unique task identifier formatted as TASK-XXX, or TASK-XXX.N for a sub-task of TASK-XXX (specification 1.1.0)."
    },
    "reviewerChecklist": {
      "type": "array",
      "items": { "type": "string" },
      "description": "Optional (specification 1.1.0). Checklist a reviewer ticks off for a sub-task: criteria met, tests present and passing, decisions respected, out-of-scope untouched, no unrelated changes."
    },
    "parentTaskId": {
      "type": ["string", "null"],
      "pattern": "^TASK-\\d{3,}(\\.\\d+)?$",
      "description": "Optional (specification 1.1.0). The task this one is a sub-task of. Absent or null for a primary task. The parent MUST be a task in the pack, the chain of parents MUST NOT loop, and a sub-task MUST list its parent in dependsOn."
    },
    "title": {
      "type": "string",
      "description": "Short imperative summary of the task objective."
    },
    "outcome": {
      "type": "string",
      "description": "Tangible deliverable produced upon task completion."
    },
    "status": {
      "type": "string",
      "enum": ["NotStarted", "InProgress", "Completed", "Blocked", "Cancelled"],
      "description": "Current lifecycle status of the task."
    },
    "sequence": {
      "type": "integer",
      "minimum": 1,
      "description": "Dependency order index."
    },
    "parallelSafe": {
      "type": "boolean",
      "description": "Whether this task can run concurrently with other tasks at the same tier."
    },
    "humanApprovalRequired": {
      "type": "boolean",
      "description": "Whether explicit human approval is required before applying or merging changes produced by this task. Required, so that no consumer has to guess a default; a consumer MUST stop for approval when it is true."
    },
    "sourceRefs": {
      "type": "array",
      "items": {
        "type": "object",
        "required": ["entityType", "entityId", "name"],
        "properties": {
          "entityType": { "type": "string" },
          "entityId": { "type": "string" },
          "name": { "type": "string" }
        }
      }
    },
    "baseline": {
      "type": "object",
      "properties": {
        "pinnedRepositoryLabel": { "type": "string" },
        "snapshotVersion": { "type": "integer" },
        "commitHash": { "type": ["string", "null"], "pattern": "^[a-fA-F0-9]{7,64}$" },
        "branch": { "type": ["string", "null"] },
        "notes": { "type": "string" }
      }
    },
    "dependsOn": {
      "type": "array",
      "items": { "type": "string", "pattern": "^TASK-\\d{3,}(\\.\\d+)?$" },
      "uniqueItems": true,
      "description": "Task IDs that must complete before this task can start."
    },
    "unlocks": {
      "type": "array",
      "items": { "type": "string", "pattern": "^TASK-\\d{3,}(\\.\\d+)?$" },
      "uniqueItems": true,
      "description": "Task IDs enabled when this task completes."
    },
    "targetScope": {
      "type": "array",
      "items": {
        "type": "object",
        "required": ["path", "status"],
        "properties": {
          "path": {
            "type": "string",
            "pattern": "^(?!.*\\.\\.)(?!^/)(?!^[a-zA-Z]:)[^\\0]+$",
            "description": "Relative workspace path; path traversal outside repository root is prohibited."
          },
          "status": { "type": "string", "enum": ["Proposed", "Existing", "Deleted", "Modified"] },
          "note": { "type": ["string", "null"] }
        }
      }
    },
    "inputs": {
      "type": "array",
      "items": { "type": "string" },
      "description": "Input files, specifications, or contracts read by the agent during this task."
    },
    "expectedOutputs": {
      "type": "array",
      "items": { "type": "string" },
      "description": "Expected output files, test suites, or artifacts generated by this task."
    },
    "allowedCapabilities": {
      "type": "array",
      "items": { "type": "string" },
      "description": "Permitted runtime capabilities (e.g. filesystem:read, filesystem:write, process:build, process:test)."
    },
    "allowedChanges": {
      "type": "array",
      "items": { "type": "string" },
      "description": "Explicit actions permitted for the agent."
    },
    "prohibitedChanges": {
      "type": "array",
      "items": { "type": "string" },
      "description": "Boundaries and forbidden modifications."
    },
    "currentStateEvidence": {
      "type": ["string", "null"],
      "description": "Current repository reality before task starts."
    },
    "changeContract": {
      "type": ["string", "null"],
      "description": "Interface, schema, or functional contracts altered."
    },
    "contractChanges": {
      "type": "array",
      "items": {
        "type": "object",
        "properties": {
          "contractType": { "type": "string" },
          "identifier": { "type": "string" },
          "changeDescription": { "type": "string" }
        }
      }
    },
    "implementationSteps": {
      "type": "array",
      "items": { "type": "string" },
      "description": "Ordered steps for coding agent execution."
    },
    "qualityAndSecurity": {
      "type": "array",
      "items": { "type": "string" },
      "description": "Security, privacy, and non-functional requirements."
    },
    "securityConstraints": {
      "type": "array",
      "items": { "type": "string" },
      "description": "Explicit security rules and isolation constraints enforced for this task."
    },
    "tests": {
      "type": "array",
      "items": { "type": "string" },
      "description": "Test verification criteria."
    },
    "commands": {
      "type": "array",
      "items": {
        "type": "object",
        "required": ["executable", "args", "purpose"],
        "properties": {
          "executable": {
            "type": "string",
            "pattern": "^[A-Za-z0-9_.][A-Za-z0-9_./+-]*$",
            "description": "Program to run, as a single word with no whitespace or shell metacharacters. It is started directly with args; it is never passed to a shell."
          },
          "args": {
            "type": "array",
            "items": { "type": "string" },
            "description": "Arguments, one array element per argument. No shell interpolation or expansion is applied."
          },
          "purpose": { "type": "string" },
          "workingDirectory": {
            "type": ["string", "null"],
            "pattern": "^(?!.*\\.\\.)(?!/)(?![a-zA-Z]:)[^\\0\\\\]+$",
            "description": "Directory relative to the repository root; null or absent means the root."
          }
        }
      },
      "description": "Commands to compile, test and verify the work, as executable plus argument array."
    },
    "rollback": {
      "type": "array",
      "items": { "type": "string" },
      "description": "Instructions to reverse partial changes."
    },
    "artifactHashes": {
      "type": "object",
      "additionalProperties": { "type": "string", "pattern": "^[a-fA-F0-9]{64}$" },
      "description": "Map of relative artifact file paths to SHA-256 integrity hashes (64 hex characters)."
    },
    "definitionOfDone": {
      "type": "array",
      "items": { "type": "string" },
      "description": "Checklist required to declare task complete."
    },
    "checkpointUpdate": {
      "type": "object",
      "properties": {
        "targetFile": { "type": "string" },
        "updatedFields": { "type": "array", "items": { "type": "string" } },
        "strategy": { "type": "string" }
      }
    },
    "escalateIf": {
      "type": "array",
      "items": { "type": "string" },
      "description": "Conditions triggering human-in-the-loop escalation."
    }
  }
}
