{
  "taskId": "TASK-004",
  "title": "Scaffold Desktop Client (ClientApp)",
  "outcome": "\u0027Desktop Client\u0027 exists as a buildable skeleton, wired into the solution, with a working health check and no feature behaviour; its sub-tasks add the features.",
  "status": "NotStarted",
  "sequence": 19,
  "parallelSafe": false,
  "humanApprovalRequired": true,
  "sourceRefs": [
    {
      "entityType": "BlueprintComponent",
      "entityId": "9a730da684404e80880bd8ddcf6b6db8",
      "name": "Desktop Client"
    },
    {
      "entityType": "TechnologyDecision",
      "entityId": "04e6e2e4e0b04159aa1067484e60d8aa",
      "name": "Technology: C# on .NET 10 with the Avalonia UI desktop toolkit"
    },
    {
      "entityType": "TechnologyDecision",
      "entityId": "8b91513dce6646c79aa70883f3c97f93",
      "name": "Technology: an embedded SQLite database file, one per user, on the user machine, accessed through Microsoft.Data.Sqlite"
    }
  ],
  "baseline": {
    "blueprintId": "a3f05f0f256c49d4836120beb3cbc4ec",
    "blueprintVersion": 2,
    "pinnedRepositoryLabel": "No existing-system baseline \u2014 greenfield project. Every target path below is Proposed, not discovered."
  },
  "dependsOn": [
    "TASK-001",
    "TASK-002",
    "TASK-003"
  ],
  "unlocks": [
    "TASK-004.1",
    "TASK-004.2",
    "TASK-004.3",
    "TASK-004.4"
  ],
  "targetScope": [
    {
      "path": "(proposed) desktopclient/",
      "status": "Proposed",
      "note": "No baseline exists for this path \u2014 treat it as a starting suggestion, not a fixed location."
    }
  ],
  "allowedChanges": [
    "Add the skeleton files within this task\u0027s target scope (desktopclient/).",
    "Add the build, wiring and health-check tests under tests/ for \u0027Desktop Client\u0027.",
    "Update service registration in the composition root / dependency injection module."
  ],
  "prohibitedChanges": [
    "Implementing feature or requirement behaviour: that belongs to the sub-tasks of this component.",
    "Modifying another task\u0027s target scope without an explicit, recorded dependency.",
    "Introducing an unapproved external package, dependency, or architecture style not recorded in the Solution Blueprint.",
    "Committing hardcoded secrets, API keys, credentials, or environment-specific values.",
    "Altering or circumventing locked user decisions and governance constraints.",
    "Persisting unmasked PII, credentials, or sensitive data in server logs or unencrypted data stores.",
    "Bypassing human approval or oversight checkpoints for irreversible or high-impact actions.",
    "Do not substitute, replace, or alter the locked decision for Technology (C# on .NET 10 with the Avalonia UI desktop toolkit).",
    "Do not substitute, replace, or alter the locked decision for Technology (an embedded SQLite database file, one per user, on the user machine, accessed through Microsoft.Data.Sqlite).",
    "Do not substitute, replace, or alter the locked decision for Technology (CSV export)."
  ],
  "currentStateEvidence": "Greenfield component per Solution Blueprint. Target responsibilities:\n\u2022 Provide the desktop user interface and its keyboard, window and file-dialog behaviour for the target operating systems.\n\u2022 Run the domain modules in-process on the user\u0027s machine; no network service is involved.\n\u2022 Keep window and view state locally; every durable fact goes through the local data store.",
  "changeContract": "No network API. The client calls the domain modules in-process; import and export file formats, if any, are recorded here.",
  "contractChanges": [
    {
      "contractType": "API",
      "changeDescription": "No network API. The client calls the domain modules in-process; import and export file formats, if any, are recorded here."
    },
    {
      "contractType": "Data",
      "changeDescription": "Holds transient interface state only; all durable data is read and written through the local data store."
    }
  ],
  "implementationSteps": [
    "Scaffold the component boundary for \u0027Desktop Client\u0027 (ClientApp) within the target scope (desktopclient/): the empty project or module structure only.",
    "Wire \u0027Desktop Client\u0027 into the composition root following existing repository conventions.",
    "Add a minimal main window that opens and closes cleanly, and a startup self-check that reports the application started.",
    "Do not implement any feature behaviour: the sub-tasks of TASK-004 (TASK-nnn.m) deliver it, one unit of functionality each.",
    "Run the build and the health check; fix only what stops the skeleton from building or starting."
  ],
  "qualityAndSecurity": [
    "Input validation at every file, clipboard and import boundary; encrypt data at rest as the data decision requires; no network trust boundary exists.",
    "No secret or key hard-coded or stored beside the data \u2014 keep encryption keys in the operating-system key store (or derive them from user input), never in source, the database file or logs.",
    "Clean architecture boundaries: adhere to separation of concerns and dependency inversion.",
    "Data handling and retention specification: Holds transient interface state only; all durable data is read and written through the local data store.",
    "API contract and security requirements: No network API. The client calls the domain modules in-process; import and export file formats, if any, are recorded here.",
    "Architecture decomposition boundary: Dedicated client presentation boundary decoupled from backend application logic to support independent UI updates and client-specific performance optimization.",
    "Data residency \u0026 lifecycle policy: The data entities are client names, task descriptions, session start and end times and notes entered by the user; they are created by the user in the app, are available and clean from the first session, and are owned by the user, with the schema versioned inside the app by migration scripts. Data quality is validated on entry (a session needs a client and a start time, overlapping sessions are fla\u2026",
    "Sensitive data governance \u0026 tokenization: The data entities are client names, task descriptions, session start and end times and notes entered by the user; they are created by the user in the app, are available and clean from the first session, and are owned by the user, with the schema versioned inside the app by migration scripts. Data quality is validated on entry (a session needs a client and a start time, overlapping sessions are fla\u2026",
    "Human oversight \u0026 approval requirements: The product lead is the Technical Decision Owner and also the Risk Owner who tracks and mitigates risks, the main one being data loss with no cloud copy. Evidence published for each release review is the test coverage report, the backup restore test result and the signed-installer verification, and the product lead approves each release and holds the veto. Exceptions and accepted risks are recorde\u2026",
    "Security \u0026 encryption standard: There are no accounts: the user is the owner of the machine and the operating system login is the only identity, and no other process is granted access to the database key held in the secure store. Data is encrypted at rest with AES-256, never leaves the machine (the update check carries no user data, and installers and updates are code-signed), and there are no secrets to manage on a server. Clie\u2026"
  ],
  "tests": [
    "The solution builds with the \u0027Desktop Client\u0027 skeleton in place.",
    "Health check test: the application starts, shows its window and exits cleanly.",
    "Full regression test suite remains 100% green - this task must not regress another component."
  ],
  "commands": [
    {
      "executable": "dotnet",
      "args": [
        "build",
        "--nologo"
      ],
      "purpose": "Build (dotnet)"
    },
    {
      "executable": "dotnet",
      "args": [
        "test",
        "--nologo"
      ],
      "purpose": "Test (dotnet)"
    }
  ],
  "rollback": [
    "git revert this task\u0027s commit(s) rather than editing history.",
    "If a database migration was applied, roll it back before reverting code \u2014 never edit an already-applied migration in place."
  ],
  "definitionOfDone": [
    "Done when \u0027Desktop Client\u0027 builds, is wired into the solution and its health check passes, with no feature behaviour added.",
    "Every step in Implementation Steps is complete.",
    "Every item in Tests passes.",
    "The repository\u0027s standard build and test commands (see Commands) are green.",
    "No unresolved \u0027to be decided\u0027 marker remains anywhere this task touched.",
    "This task\u0027s checkpointUpdate has been applied to execution-state.json."
  ],
  "checkpointUpdate": {
    "targetFile": "07-agent/execution-state.json",
    "updatedFields": [
      "tasks[].status",
      "tasks[].completedAt",
      "nextSafeAction"
    ],
    "strategy": "Set this task\u0027s status to \u0027completed\u0027 and record completedAt, then recompute nextSafeAction as the first remaining not_started task whose dependsOn are all completed."
  },
  "escalateIf": [
    "Completing this task\u0027s Outcome would require an architecture, data-model, or public-contract choice not already recorded in the Solution Blueprint \u2014 stop and ask a human rather than deciding it yourself.",
    "A required credential, access grant, or environment value is missing.",
    "The repository\u0027s actual current state no longer matches this task\u0027s pinned baseline (see START_HERE.md\u0027s baseline-drift reconciliation guidance).",
    "A required human approval workflow or sign-off checkpoint is absent or bypassed."
  ]
}